{
  "schemaVersion": "lae.operation-event/v1",
  "eventId": "evt_01JEXAMPLE",
  "operationId": "op_01JEXAMPLE",
  "seq": 4,
  "type": "builder.analyze.progress",
  "phase": "source.analyze",
  "status": "running",
  "level": "info",
  "message": "Detected a Compose application with two services.",
  "occurredAt": "2026-07-11T12:00:00Z",
  "data": {"completedRules": 18, "totalRules": 25}
}
